{
  "schema_version": 1,
  "id": "evaluation-01",
  "provenance": "target",
  "source": {
    "date": "2026-09-20T12:33:26.921Z",
    "url": "https://www.latelierdescafes.com/wp-json/wc/store/v1/cart",
    "capture_hash": "f7bab9cc136c80276eb62a7e9727132d0f44d6c16ea66f6c9a7ec9f58490f8c8",
    "action_channel": "Existing headed guest browser, selective Woo cookie/cache reset, browser cookies and standard Store API Nonce; POST responses plus actual GET after every action."
  },
  "context": {
    "country": "FR",
    "role": "guest",
    "currency": "EUR",
    "currency_minor_unit": 2,
    "prices_include_tax": true
  },
  "seed_file": "target/seed.json",
  "actions": [
    {
      "type": "add",
      "ref": "spatules",
      "qty": 2
    },
    {
      "type": "add",
      "ref": "cafe-decouverte",
      "variant": "250g-grains",
      "qty": 1
    },
    {
      "type": "apply_coupon",
      "code": "DECOUVERTE10"
    }
  ],
  "expected": {
    "lines": [
      {
        "ref": "spatules",
        "qty": 2,
        "line_subtotal": 250,
        "line_subtotal_tax": 50,
        "line_total": 250,
        "line_total_tax": 50
      },
      {
        "ref": "cafe-decouverte",
        "variant": "250g-grains",
        "qty": 1,
        "line_subtotal": 946,
        "line_subtotal_tax": 52,
        "line_total": 851,
        "line_total_tax": 47
      }
    ],
    "coupons": [
      {
        "code": "decouverte10",
        "total_discount": 95,
        "total_discount_tax": 5
      }
    ],
    "totals": {
      "total_items": 1196,
      "total_items_tax": 102,
      "total_discount": 95,
      "total_discount_tax": 5
    },
    "decisions": [
      {
        "action_index": 0,
        "accepted": true
      },
      {
        "action_index": 1,
        "accepted": true
      },
      {
        "action_index": 2,
        "accepted": true
      }
    ]
  },
  "checkpoints": [
    {
      "after_action": 0,
      "expected": {
        "lines": [
          {
            "ref": "spatules",
            "qty": 2,
            "line_subtotal": 250,
            "line_subtotal_tax": 50,
            "line_total": 250,
            "line_total_tax": 50
          }
        ],
        "coupons": [],
        "totals": {
          "total_items": 250,
          "total_items_tax": 50,
          "total_discount": 0,
          "total_discount_tax": 0
        }
      }
    },
    {
      "after_action": 1,
      "expected": {
        "lines": [
          {
            "ref": "spatules",
            "qty": 2,
            "line_subtotal": 250,
            "line_subtotal_tax": 50,
            "line_total": 250,
            "line_total_tax": 50
          },
          {
            "ref": "cafe-decouverte",
            "variant": "250g-grains",
            "qty": 1,
            "line_subtotal": 946,
            "line_subtotal_tax": 52,
            "line_total": 946,
            "line_total_tax": 52
          }
        ],
        "coupons": [],
        "totals": {
          "total_items": 1196,
          "total_items_tax": 102,
          "total_discount": 0,
          "total_discount_tax": 0
        }
      }
    },
    {
      "after_action": 2,
      "expected": {
        "lines": [
          {
            "ref": "spatules",
            "qty": 2,
            "line_subtotal": 250,
            "line_subtotal_tax": 50,
            "line_total": 250,
            "line_total_tax": 50
          },
          {
            "ref": "cafe-decouverte",
            "variant": "250g-grains",
            "qty": 1,
            "line_subtotal": 946,
            "line_subtotal_tax": 52,
            "line_total": 851,
            "line_total_tax": 47
          }
        ],
        "coupons": [
          {
            "code": "decouverte10",
            "total_discount": 95,
            "total_discount_tax": 5
          }
        ],
        "totals": {
          "total_items": 1196,
          "total_items_tax": 102,
          "total_discount": 95,
          "total_discount_tax": 5
        }
      }
    }
  ],
  "notes": "Candidate evidence from exact preregistered actions and actual merchant responses. No clone or discovery-outcome comparison. Operator-authorized FR-only acquisition precondition; no city/postcode initialization. Reset and empty-guest-cart preflight are recorded separately from registered actions."
}
